{
  "case_id": "IMG-001",
  "human_verified": true,
  "transcription": {
    "full_text": "",
    "math_expressions": [],
    "layout_blocks": []
  },
  "education_mapping": {
    "grade_context": 4,
    "candidate_skill_ids": [],
    "problem_types": [],
    "knowledge_level": "K2",
    "thinking_level": "T2"
  },
  "student_work": {
    "question_count": 0,
    "student_answers": [],
    "correctness_by_item": [],
    "error_locations": []
  },
  "privacy": {
    "pii_removed_before_provider": true,
    "pii_types_detected": []
  }
}